{
  "$schema": "http://json-schema.org/draft-07/schema#",
  "$comment": "GENERATED by gui/schema-gen/derive_nf_config_schemas.py from config/udm.json + its source (ADR-0425). Do not edit; regenerate.",
  "title": "udm",
  "type": "object",
  "additionalProperties": false,
  "properties": {
    "port": {
      "type": "integer",
      "x-cpp-type": "unsigned short"
    },
    "sbi_bind_address": {
      "type": "string",
      "x-cpp-type": "std::string"
    },
    "metrics_bind_address": {
      "type": "string",
      "x-cpp-type": "std::string"
    },
    "nrf_base_url": {
      "type": "string",
      "x-env-override": "UDM_NRF_BASE_URL",
      "x-cpp-type": "std::string"
    },
    "udr_base_url": {
      "type": "string",
      "x-env-override": "UDM_UDR_BASE_URL",
      "x-cpp-type": "std::string"
    },
    "vlr_peer_address": {
      "type": "string",
      "x-env-override": "UDM_VLR_PEER_ADDRESS",
      "x-cpp-type": "std::string"
    },
    "vlr_peer_port": {
      "type": "integer",
      "x-env-override": "UDM_VLR_PEER_PORT",
      "x-cpp-type": "std::uint16_t"
    },
    "map_server_port": {
      "type": "integer",
      "x-env-override": "UDM_MAP_SERVER_PORT",
      "x-cpp-type": "std::uint16_t"
    },
    "hlr_number": {
      "type": "string",
      "x-env-override": "UDM_HLR_NUMBER",
      "x-cpp-type": "std::string"
    },
    "li_poi": {
      "type": "object",
      "additionalProperties": false,
      "properties": {
        "enabled": {
          "type": "boolean"
        },
        "x1_bind_address": {
          "type": "string"
        },
        "x1_port": {
          "type": "integer"
        },
        "ne_identifier": {
          "type": "string"
        },
        "network_function_id": {
          "type": "string"
        },
        "interception_point_id": {
          "type": "string"
        },
        "mdf2_host": {
          "type": "string"
        },
        "mdf2_port": {
          "type": "integer"
        },
        "mdf2_sni": {
          "type": "string"
        },
        "x1_keepalive_p1_seconds": {
          "type": "integer"
        },
        "x1_keepalive_p2_seconds": {
          "type": "integer"
        },
        "x1_keepalive_p3_seconds": {
          "type": "integer"
        },
        "x1_allow_deactivate_all": {
          "type": "boolean"
        }
      }
    },
    "home_plmns": {
      "type": "array",
      "items": {
        "type": "object",
        "additionalProperties": false,
        "properties": {
          "mcc": {
            "type": "string"
          },
          "mnc": {
            "type": "string"
          }
        }
      }
    },
    "oauth2_required": {
      "type": "boolean",
      "x-env-override": "UDM_OAUTH2_REQUIRED",
      "x-cpp-type": "bool"
    }
  },
  "required": [
    "hlr_number",
    "map_server_port",
    "metrics_bind_address",
    "nrf_base_url",
    "port",
    "sbi_bind_address",
    "udr_base_url",
    "vlr_peer_address",
    "vlr_peer_port"
  ],
  "x-config-file": "config/udm.json",
  "x-source": [
    "nfs/udm"
  ],
  "x-apply": "restart",
  "x-review": [
    "li_poi: nested object shape inferred from current values (map-vs-struct meaning unverified; new keys refused until reviewed)",
    "home_plmns[]: nested object shape inferred from current values (map-vs-struct meaning unverified; new keys refused until reviewed)"
  ]
}
