{
  "port": 7780,
  "sbi_bind_address": "0.0.0.0",
  "metrics_bind_address": "0.0.0.0:9467",
  "nrf_base_url": "https://127.0.0.1:7777",
  "udr_base_url": "https://127.0.0.1:7781",
  "vlr_peer_address": "",
  "vlr_peer_port": 2905,
  "map_server_port": 0,
  "hlr_number": "99970000001",
  "li_poi": {
    "enabled": false,
    "x1_bind_address": "0.0.0.0",
    "x1_port": 7813,
    "ne_identifier": "udm-poi-01",
    "network_function_id": "udm-01.5gc.example.net",
    "interception_point_id": "UDM-IRI-POI-1",
    "mdf2_host": "127.0.0.1",
    "mdf2_port": 7806,
    "mdf2_sni": "localhost",
    "x1_keepalive_p1_seconds": 60,
    "x1_keepalive_p2_seconds": 180,
    "x1_keepalive_p3_seconds": 300,
    "x1_allow_deactivate_all": true
  },
  "home_plmns": [
    {
      "mcc": "999",
      "mnc": "70"
    }
  ],
  "oauth2_required": true
}
